"Timestamp","User","Action","Result","Details"
"2026-07-14T18:42:58","alicia.nguyen@rashawntech12outlook.onmicrosoft.com","Join","Success","Groups: Finance-Team;All-Employees; Temp password issued"
"2026-07-14T18:42:59","marcus.reyes@rashawntech12outlook.onmicrosoft.com","Join","Success","Groups: IT-Team;All-Employees; Temp password issued"
"2026-07-14T18:43:02","marcus.reyes@rashawntech12outlook.onmicrosoft.com","Leave","Success","Account disabled, groups stripped, sessions revoked"
"2026-07-14T18:50:36","alicia.nguyen@rashawntech12outlook.onmicrosoft.com","Move","Success","New title: Senior Financial Analyst; Dept: Finance"
"2026-07-14T18:50:37","marcus.reyes@rashawntech12outlook.onmicrosoft.com","Leave","Success","Account disabled, groups stripped, sessions revoked"
